{
  "schema_version": "1.0",
  "attestation_type": "factor_weights",
  "artifact": {
    "sha256": "0000000000000000000000000000000000000000000000000000000000000000",
    "coverage_start": "2026-07-01",
    "coverage_end": "2026-08-21"
  },
  "production": {
    "synthetic": false,
    "source_repository": "owner/multi-factor-platform",
    "source_commit": "0000000000000000000000000000000000000000",
    "pipeline_run_id": "MF-RUN-REPLACE-ME",
    "generated_at": "2026-08-21T02:00:00+00:00"
  },
  "quality": {
    "point_in_time": true,
    "universe_membership_point_in_time": true,
    "unresolved_exceptions": []
  }
}
